{
  "$schema": "https://json-schema.org/draft/2020-12/schema",
  "$id": "https://srs.semanticops.com/schema/2.0/note.json",
  "title": "SRS Note (Tier 0)",
  "description": "A lightweight instance with no Type binding. The lowest-ceremony entry point in SRS.",
  "type": "object",
  "required": ["instanceId", "sections"],
  "additionalProperties": false,
  "properties": {
    "$schema": { "type": "string" },
    "instanceId": {
      "type": "string",
      "format": "uuid"
    },
    "title": { "type": "string" },
    "tags": {
      "type": "array",
      "items": { "type": "string", "minLength": 1 },
      "description": "Free-form topic labels for discovery and filtering. Not semantically defined; use Relations for semantic claims."
    },
    "sections": {
      "type": "array",
      "items": { "$ref": "#/$defs/NoteSection" },
      "description": "Ordered list of named text sections."
    },
    "graduatedAt": {
      "type": "string",
      "format": "date-time",
      "description": "When set, signals full formalisation. Authoritative record of successors is in derived-from Relations from the successor Records."
    },
    "sourceRefs": {
      "type": "array",
      "items": { "$ref": "#/$defs/SourceReference" },
      "description": "References to source material from which this Note was derived."
    },
    "createdAt": { "type": "string", "format": "date-time" },
    "updatedAt": { "type": "string", "format": "date-time" },
    "meta": {
      "type": "object",
      "description": "Implementation-local key-value pairs. Cross-system keys should be namespaced."
    }
  },
  "$defs": {
    "NoteSection": {
      "type": "object",
      "required": ["name", "content"],
      "additionalProperties": false,
      "properties": {
        "name": {
          "type": "string",
          "description": "Section key; unique within the Note; snake_case recommended."
        },
        "label": { "type": "string" },
        "content": { "type": "string" },
        "contentHint": {
          "type": "string",
          "enum": ["text", "markdown", "plain"],
          "description": "Hint only; default: text."
        },
        "tags": {
          "type": "array",
          "items": { "type": "string", "minLength": 1 },
          "description": "Section-level topic labels; supplements or narrows Note-level tags."
        }
      }
    },
    "SourceReference": {
      "type": "object",
      "required": ["sourceType", "sourceId"],
      "additionalProperties": false,
      "not": { "required": ["sourceRole", "relationType"] },
      "allOf": [
        {
          "if": {
            "properties": { "sourceType": { "const": "repository-document" } },
            "required": ["sourceType"]
          },
          "then": {
            "properties": { "sourceId": { "format": "uuid" } }
          }
        }
      ],
      "properties": {
        "sourceType": {
          "type": "string",
          "enum": ["transcript-chunk", "transcript-segment", "external-document", "repository-document"],
          "description": "'repository-document' is added by ext:repository."
        },
        "sourceId": { "type": "string", "description": "Free-form when sourceType is transcript-chunk/transcript-segment/external-document. When sourceType is repository-document, MUST be a SourceDocument.documentId (format: uuid, RFC-017) — enforced by the sibling if/then." },
        "sourceStandard": { "type": "string" },
        "streamId": { "type": "string", "format": "uuid" },
        "sourceRole": {
          "type": "string",
          "enum": ["evidence", "extracted-from", "quoted-from", "inspired-by", "attaches"],
          "description": "The role the source material plays for this instance (RFC-023). Replaces relationType. 'attaches' added by RFC-017: material attachment of a source document to a record (RFC-017 [R1])."
        },
        "relationType": {
          "type": "string",
          "deprecated": true,
          "enum": ["evidence", "derived-from", "quoted-from", "inspired-by", "supersedes-context"],
          "description": "DEPRECATED (RFC-023): legacy name for sourceRole. Readers accept it during the migration window (SOURCEREF_LEGACY_RELATIONTYPE warning) using the RFC-023 Change B value mapping; writers must not emit it. Removed by a scheduled follow-up schema revision."
        },
        "confidence": { "type": "number", "minimum": 0, "maximum": 1 },
        "note": { "type": "string" }
      }
    }
  }
}
